No hurricane has ever crossed the equator,,2025-03-08 10:39:14,2348,50460,https://i.redd.it/jz8ulmm1khne1.jpeg
Can you stop a hurricane with a nuke?,,2025-03-14 08:24:17,1845,28006,https://v.redd.it/7mzhtu3qenoe1
Stump throne I carved after a hurricane - named it Stormfell,,2025-04-10 11:23:40,813,44036,https://www.reddit.com/gallery/1jw0kn3
Hurricane Milton,,2024-10-07 21:05:02,13014,135403,https://i.redd.it/tnygjujfmftd1.png
My meals while staying at the shelter after Hurricane Helene,,2024-10-05 04:38:32,4413,58575,https://www.reddit.com/gallery/1fwlx9j
Tucker Carlson claims hurricanes hitting US 'probably because of abortion',,2024-11-04 21:30:13,2190,42403,https://www.the-express.com/news/politics/153627/tucker-carlson-abortion-hurricanes-election-day
Ron DeSantis is refusing to take Harris' call on Hurricane Helene,,2024-10-07 13:24:00,3710,44764,https://www.nbcnews.com/politics/kamala-harris/ron-desantis-harris-call-hurricane-helene-political-rcna174276
Kamala Harris 'is in control of this hurricane' using 'weather weapons': Alex Jones,,2024-10-08 15:03:50,4202,32913,https://www.rawstory.com/alex-jones-hurricane/
Air Force Reserve Hurricane Hunters flying through Hurricane Milton,,2024-10-08 14:06:46,2588,60828,https://v.redd.it/3zawnuepoktd1
Milton Is the Hurricane That Scientists Were Dreading,,2024-10-08 11:45:32,4531,29754,https://www.theatlantic.com/science/archive/2024/10/hurricane-milton-climate-change/680188/?utm_source=reddit&utm_medium=social&utm_campaign=the-atlantic&utm_content=edit-promo
US meteorologists face death threats as hurricane conspiracies surge,,2024-10-11 12:02:02,3247,35254,https://www.theguardian.com/us-news/2024/oct/11/meteorologists-death-threats-hurricane-conspiracies-misinformation
No hurricane ever crossed the equator,,2024-10-01 08:52:20,2343,103636,https://i.redd.it/gmhh23h665sd1.png
Taylor Swift Donates $5 Million to Hurricane Helene and Milton Relief Efforts,,2024-10-09 18:09:51,2535,49924,https://variety.com/2024/music/news/taylor-swift-donates-hurricane-milton-relief-1236173667/
Hurricane Helene,,2024-09-27 13:55:22,2942,63027,https://i.imgflip.com/94wpa8.jpg
Florida Gov. DeSantis refused call from VP Kamala Harris about hurricane aid,,2024-10-08 06:41:26,2820,41502,https://i.redd.it/qrpxku92hitd1.png
President Trump showing off his personally altered map of hurricane path prediction,,2024-10-09 10:18:12,2850,30430,https://i.redd.it/8nzi14ufoqtd1.jpeg
Timelapse of hurricane Milton from the International Space Station captured few hours ago.,,2024-10-08 13:29:09,1912,63091,https://v.redd.it/mkf4y9wzhktd1
Florida man protects his car from hurricane Milton ,,2024-10-09 14:47:17,2571,19887,https://v.redd.it/q9cfi3tu0std1
Several Florida jails and prisons refuse to evacuate ahead of Hurricane Milton,,2024-10-09 12:16:10,1823,25798,https://www.theguardian.com/us-news/2024/oct/09/inmate-evacuation-hurricane-milton-jail-prison-florida
My neighbor says Biden is behind the hurricane. ,,2024-10-07 23:51:13,2247,20773,https://i.redd.it/pphs9rq2ggtd1.png
Where are all the man made hurricane counter experts?,,2024-10-08 09:45:04,1574,26931,https://i.redd.it/237rko21ejtd1.jpeg
"Florida is on alert as Tropical Storm Milton forms in the Gulf, just days after Hurricane Helene",,2024-10-05 14:27:14,1867,20212,https://www.cnn.com/2024/10/05/weather/tropical-storm-milton-florida-gulf-of-mexico
"CEO escapes hurricane, forces employees to stay causing death",,2024-10-16 15:33:34,1179,29973,https://i.redd.it/o0unzcph76vd1.jpeg
"President Biden and Gov. DeSantis visit Fort Meyers, Florida after Hurricane Ian (2022)",,2024-09-02 19:10:20,1705,45706,https://i.redd.it/7jkbl482ahmd1.jpeg
Tennessee plastics factory staff killed in Hurricane Helene reportedly told not to evacuate | Hurricane Helene,,2024-10-01 14:53:38,1273,34572,https://www.theguardian.com/us-news/2024/oct/01/tennessee-plastics-factory-hurricane
“They can control hurricanes!”,,2024-10-06 15:44:25,966,55507,https://i.redd.it/elwnrvjbw6td1.jpeg
Trump Claims ‘Nobody Thought’ a Hurricane Would Hit This Time of Year Despite It Being Peak Hurricane Season,,2024-09-30 15:45:35,1136,35832,https://www.mediaite.com/trump/trump-claims-nobody-thought-a-hurricane-would-hit-this-time-of-year-despite-it-being-peak-hurricane-season/
"The storm surge for Hurricane Milton is expected to be 15 feet. To give you an idea of how deadly this is, here's what 9 feet looks like:",,2024-10-09 03:12:35,1117,28671,https://v.redd.it/a9wvqvswkotd1
This is what a 15 foot hurricane storm surge looks like. It's terrifying.,,2024-10-09 19:02:46,1036,31400,https://v.redd.it/7mrig5pbattd1
"To people in Florida : how is the evacuation, situation with Hurricane Milton? ",,2024-10-09 01:33:47,2166,11501,https://www.reddit.com/r/AskReddit/comments/1fzkcug/to_people_in_florida_how_is_the_evacuation/
Taylor Swift Donates $5 Million to Hurricane Helene and Milton Relief Efforts,,2024-10-09 17:24:02,1277,17247,https://variety.com/2024/music/news/taylor-swift-donates-hurricane-milton-relief-1236173667
Florida Jail in Hurricane Milton Danger Zone Won't Evacuate Inmates,,2024-10-08 23:07:30,1130,18918,https://www.newsweek.com/florida-jail-hurricane-milton-evacuation-zone-manatee-county-1965915
President Biden holds a briefing on Hurricane Milton preparation and Hurricane Helene response.,,2024-10-08 14:14:18,892,26944,https://i.redd.it/1zvd3w42pktd1.jpeg
Mayorkas warns FEMA doesn’t have enough funding to last through hurricane season,,2024-10-03 09:17:20,1405,13729,https://apnews.com/article/hurricane-helene-congress-fema-funding-5be4f18e00ce2b509d6830410cf2c1cb
"Milton strengthens into Category 4 hurricane, triggers storm surge warnings for Florida's Gulf Coast",,2024-10-07 09:29:52,1258,14360,https://www.nbcnews.com/news/weather/hurricane-milton-strengthens-major-storm-florida-rcna174229
Hurricane Trump is having a category 5 meltdown! 🌀,https://x.com/EdKrassen/status/1841615022797303969?t=OLhqPYwzI31qJNykTHV3rg&s=19,2024-10-02 21:29:48,940,19977,https://i.redd.it/ql1crmka2gsd1.png
Some in Hurricane Helene-ravaged North Carolina embrace Trump’s push to abolish FEMA,,2025-02-16 14:22:58,727,5369,https://apnews.com/article/hurricane-helene-fema-north-carolina-trump-disasters-2b22a4943f4621d8704108d71e1386d1
Hurricane Milton dips to Category 3 as it heads for Florida landfall,,2024-10-09 17:09:32,850,19113,https://www.cbsnews.com/news/hurricane-milton-florida-landfall-path-storm/
Hurricane Beryl makes history as first Cat 4 storm ever to form in June,,2024-06-30 17:10:17,2101,24699,https://www.nola.com/news/hurricane/beryl-makes-history-as-first-cat-4-hurricane-to-form-in-june/article_8793f516-36ed-11ef-9da8-9f758c022ea0.html
Hurricane about to wipe the west coast clean of helene.,,2024-10-06 10:20:29,1100,11284,https://i.redd.it/wlhckozia5td1.jpeg
"by Ron DeSantis to stage a hurricane recovery press conference by stacking actual garbage behind his podium, all while shaming other politicians for exploiting the disaster",,2024-10-13 21:42:16,620,22579,https://v.redd.it/hmztrx7jmmud1
Hypocrite MTG Now Demanding Hurricane Relief Funds She Tried to Block,,2024-09-30 20:17:25,647,24255,https://newrepublic.com/post/186541/marjorie-taylor-greene-hurricane-helene-relief-government-funding
"Texas Roadhouse is full, so I don't need to evacuate for hurricane","My parents live in the ""A"" evacuation zone in western Florida (aka, you go first because it'll be that bad), but don't think a category 5 will damage their home. They're staying because their friends are, and they went out to eat tonight and the restaurant was full. Also, ""the media hypes this up to sell papers."" So, you know, totally fine. 

I'm beyond furious.",2024-10-07 21:18:26,1378,7869,https://www.reddit.com/r/BoomersBeingFools/comments/1fyo4re/texas_roadhouse_is_full_so_i_dont_need_to/
"This video shows the differences between a category 1, 2, 3, 4, & 5 hurricane in regard to potential home damage.",,2024-10-08 08:16:06,651,19093,https://streamable.com/n7t857
Hurricane Helene: More than 100 dead and 500 miles of damage | CNN,,2024-09-30 12:03:30,882,12094,https://www.cnn.com/2024/09/30/weather/hurricane-helene-recovery-cleanup-monday/index.html
Nuking a hurricane ,,2025-01-01 08:28:41,318,44396,https://i.redd.it/2jl6h42lwdae1.png
Kamala Harris 'is in control of this hurricane' using 'weather weapons': Alex Jones,,2024-10-08 14:20:48,1197,7942,https://www.rawstory.com/alex-jones-hurricane/
Hurricanes,https://x.com/drawandstrike/status/1842789595194523839,2024-10-07 12:37:25,642,15782,https://i.redd.it/e6il7ubv3dtd1.jpeg
"Scenes from the aftermath of Hurricane Katrina, 2005.",Photographer: Richard Misrach,2025-01-25 13:53:47,346,12577,https://www.reddit.com/gallery/1i9u0kb
"This is Hurricane Beryl. It is currently a major Category 4 hurricane in the Atlantic Ocean, a phenomenon that has never been recorded to happen in June ever before. ",,2024-06-30 11:58:41,1197,19321,https://i.redd.it/y1pt1j0peq9d1.png
Cuba grid collapses again as hurricane looms,,2024-10-20 20:18:36,863,8278,https://www.yahoo.com/news/cuba-suffers-third-major-setback-074214386.html
Guy Battles Hurricane Milton to Put Up a Trump Flag,,2024-10-09 22:11:06,1253,6777,https://v.redd.it/dqquim718utd1
"Hurricane Beryl strengthens into a category 5 storm, earliest on record",,2024-07-01 23:01:09,1336,15583,https://www.clickorlando.com/weather/2024/07/02/hurricane-beryl-strengthens-into-a-category-5-storm-earliest-on-record/
Man loses 11 family members in Hurricane Helene: Report,,2024-10-09 23:31:24,602,15050,https://abcnews.go.com/GMA/Family/man-loses-11-members-family-hurricane-helene/story?id=114601619
"Keeping the casket center frame, through the trees, in the middle of a hurricane. ",,2024-10-01 15:22:30,593,17471,https://v.redd.it/sg21uift37sd1
We should nuke hurricanes,,2024-04-21 06:05:54,1328,37556,https://i.redd.it/z385g5py3tvc1.png
"Hurricane Milton is near the mathematical limit of what a hurricane from that area can produce. It has sustained 180 mph winds, and has an eye only 3.8 miles wide allowing it to spin faster. It’s the 4th strongest hurricane on the western side of the world if you measure it by pressure at 897mb.",,2024-10-08 07:00:54,726,9602,https://www.reddit.com/gallery/1fyx165
Why do hurricanes not affect California?,"Is this picture accurate? Of course, there’s more activity for the East Coast, but based on this, we should at least think about hurricanes from time to time on the West Coast. I’ve lived in California for 8 years, and the only thought I’ve ever given to hurricanes is that it’s going to make some big waves for surfers.",2024-10-08 23:43:13,1010,6827,https://i.redd.it/zrlwjr6kjntd1.jpeg
Trump's administration denies extension for hurricane relief in Georgia,,2025-02-16 14:49:45,387,6314,https://www.11alive.com/article/news/politics/trump-administration-denies-extension-hurricane-relief-georgia/85-bb8fc79d-a064-4e31-a460-c034b1266f11
The difference between category 1- 5 hurricanes ,,2024-10-08 16:15:55,596,11749,https://v.redd.it/q6ssajkqbltd1
6.8 magnitude earthquake shakes Cuba after hurricanes and blackouts,,2024-11-10 14:58:13,450,11908,https://apnews.com/article/cuba-earthquake-hurricanes-natural-disaster-c28bbf4496a1bbe27a39f80728d63b2d
🔥 Comparison of Hurricanes Katrina & Helene plus Helene's path of destruction.,"To say the least, none of us that experienced this storm was prepared for it.

The image shows Hurricane Helene compared with Katrina. The sheer size of Helene is mind blowing. 

Now, before anyone starts debating, while Katrina did become a category 5 hurricane at one point, it made landfall as a category 3. Also, this post isn’t a comparison in which storm was “worse” or had the greatest impact/loss of life. They are both terrible. Katrina is simply a good comparison because of its devastation.",2024-10-02 23:50:41,511,14158,https://i.redd.it/irpgn0gfrgsd1.jpeg
MAGA Congressional Rep From Georgia Who Opposed Federal Hurricane Relief Funds Last Week is Desperately Asking For Federal Hurricane Relief Funds This Week,,2024-09-30 18:39:50,456,18234,https://newrepublic.com/post/186541/marjorie-taylor-greene-hurricane-helene-relief-government-funding
Cuba grid collapses again as hurricane looms,,2024-10-20 18:36:08,779,6324,https://www.reuters.com/world/americas/cuba-suffers-third-major-setback-restoring-power-island-millions-still-dark-2024-10-20/
Biden Fumes After Reporter Parrots Trump Lies on Hurricane Helene,,2024-10-01 12:52:46,417,23384,https://newrepublic.com/post/186557/biden-fumes-trump-hurricane-helene-lies
Trump “Reroutes” Hurricane Dorian to Alabama,,2024-07-23 19:58:33,860,10318,https://i.redd.it/xbtlhukaxced1.jpeg
Helene rapidly intensifies into a hurricane on its path to the strongest storm to hit the US in over a year,,2024-09-25 12:45:35,614,8892,https://www.cnn.com/2024/09/25/us/helene-tropical-storm-florida-evacuations/index.html
The Tropicana Roof has been ripped open due to Hurricane Milton,,2024-10-09 23:06:33,734,6391,https://v.redd.it/m2pdwqhwhutd1
"Johnson says hurricane aid ""can wait"" until after House recess",,2024-10-13 14:21:14,504,9492,https://www.axios.com/2024/10/13/mike-johnson-hurricane-aid-milton-helene
"The damage to a solar farm after a major hurricane (Duke Energy Solar Plant at Lake Placid, FL)",,2024-10-13 20:13:31,615,7129,https://v.redd.it/6ctb4dsj6mud1
Tropicana Field’s stadium following Hurricane Milton damage,,2024-10-10 13:45:25,581,7619,https://v.redd.it/hdynpx5quytd1
PSA: If you live in the path of hurricane Milton take your pets with you: During Hurricane Katrina Residents Were Told To Leave Their Pets In A School And Police Executed All Of Them,,2024-10-08 13:02:14,581,7454,https://v.redd.it/rseefqvecktd1
Helene strengthens to a Category 4 hurricane as it nears Florida's Gulf Coast,,2024-09-26 20:53:51,637,7239,https://apnews.com/article/hurricane-helene-florida-georgia-mexico-42fb7cc90604b7f87179920f97627873
The water has been sucked out of Tampa Bay by Hurricane Milton,,2024-10-09 20:57:12,454,9972,https://x.com/BrianEntin/status/1844170710102704585
My boyfriends beard hair grows in like a hurricane pattern,,2023-10-09 12:09:02,2894,41783,https://i.redd.it/sbaj4cwza7tb1.jpg
This is what a 15 foot hurricane storm surge looks like. It's terrifying. ,,2024-10-09 19:07:41,368,15382,https://v.redd.it/68igmys7bttd1
Tropicana Field roof ripped off by Hurricane Milton,,2024-10-09 23:23:07,373,13898,https://i.redd.it/zwov25gvkutd1.jpeg
Matt Gaetz voted against FEMA funding right before Hurricane Helene struck,,2024-10-01 02:28:42,340,20936,https://www.newsweek.com/matt-gaetz-voted-against-fema-funding-before-hurricane-helene-hit-1961501
An O'Reilly Auto Parts Store with a message in NC after Hurricane Helene.,,2024-09-30 10:01:08,877,4806,https://i.redd.it/60efnuvldyrd1.jpeg
"Hurricane Milton Is Terrifying, and It Is Just the Start",,2024-10-09 10:04:38,671,5494,https://www.nytimes.com/2024/10/09/opinion/hurricane-milton-florida-storm-surge-climate-change.html?unlocked_article_code=1.Q04.nVHd.5gbp4vGIY88l&smid=url-share
Taylor Swift Donates $5 Million to Hurricane Helene and Milton Relief Efforts,,2024-10-09 17:12:49,468,8229,https://variety.com/2024/music/news/taylor-swift-donates-hurricane-milton-relief-1236173667/
The hurricane gave me a Tortie,"So I am NOT a cat person, I never really have been. But Hurricane Helene blew through my town (Anderson, SC) and displaced this little kitten from its mother. I found her in my yard crying, so walked around with her meowing for hours, trying to find its mama. No luck.

I put posts up on Facebook and Instagram, seeing if anyone would take her off my hands. No one I know could take in the kitten.

So I started feeding her and giving her attention and keeping her warm. She’s a good little cat! I gotta keep her outside, but I’m doing everything I can for her. I never thought I’d get attached to a cat, lol

Just now reading that she’s a Tortie. I can definitely see the sass already. Still haven’t named her. Maybe Helene??",2024-10-06 21:31:04,309,24658,https://i.redd.it/29zzsvw4m8td1.jpeg
Texans use Whataburger app to track power outages caused by Hurricane Beryl,,2024-07-09 19:25:36,583,12971,https://www.sacurrent.com/news/texans-use-whataburger-app-to-track-power-outages-caused-by-hurricane-beryl-35011651
"Florida's insurers deny over 37,000 hurricane claims",,2024-10-24 10:05:48,436,7872,https://www.newsweek.com/florida-insurers-deny-37000-helene-milton-hurricane-claims-1974123
No Hurricane has ever crossed the equator,,2024-06-17 14:02:24,591,14948,https://v.redd.it/jpgxnmox867d1
"Queer bar destroyed by hurricane raises $193,000 to rebuild & pay employees",,2024-10-11 20:47:21,340,14222,https://www.lgbtqnation.com/2024/10/queer-bar-destroyed-by-hurricane-raises-193000-to-rebuild-pay-employees/
Tropicana Field roof ripped off by Hurricane Milton,,2024-10-09 23:17:12,361,11782,https://i.redd.it/ofjc4fhjjutd1.jpeg
"Taylor Swift donates $5 million to Hurricane Helene, Milton relief efforts",,2024-10-09 19:22:46,482,6999,https://www.fox4news.com/news/taylor-swift-donates-5-million-hurricane-helene-milton-relief-2024
Republicans who voted against FEMA funding now face Hurricane Milton threat,,2024-10-08 09:54:55,459,7663,https://www.newsweek.com/hurricane-milton-republicans-voted-against-fema-funding-storm-path-florida-1965181
The destruction of a dream by Hurricane Helene,,2024-10-02 01:01:10,539,6491,https://v.redd.it/jkk30nh1z9sd1
After Hurricane Idalia,,2023-08-31 09:01:55,2125,42544,https://i.redd.it/zgmodq622glb1.jpg
"Hurricane Milton could be worst storm in a century as officials say, 'If you stay, you're going to die'",,2024-10-08 11:17:03,494,6631,https://www.themirror.com/news/us-news/hurricane-milton-could-worst-storm-737090
Footage from hurricane Helene ,,2024-10-09 19:23:58,326,14151,https://v.redd.it/igak3xz7ettd1
Hurricane Milton could cost Disney World $200 million,,2024-10-09 15:44:47,586,5403,https://floridapolitics.com/archives/700597-hurricane-milton-could-cost-disney-world-200-million/
No hurricane has ever crossed the equator,,2023-09-18 15:32:08,1695,44865,https://i.redd.it/956eswc0g2pb1.jpg
Hurricane Milton,,2024-10-07 21:03:11,476,6761,https://i.redd.it/17kinho3mftd1.png
"FEMA slashes $300 million in flooding, hurricane relief projects in Florida",,2025-04-13 14:38:24,269,3482,https://www.tampabay.com/ap/2025/04/11/fema-cuts-florida-trump/
Tulip is ready for his third ever MMO Florida hurricane ,"We are not in an evacuation zone and pretty far inland so not anticipating anything crazy. 

I dressed Tulip in his harness for emergencies just in case! ❤️",2024-10-09 16:28:56,291,18285,https://i.redd.it/hbmi5xdzistd1.jpeg
"Uh, this sorta looks like a hurricane ",,2024-11-18 12:13:03,797,3353,https://i.redd.it/8sly03fi0p1e1.png
Voters in North Carolina voted for Donald Trump believing that the MAGA leader would help state residents recover from storm damage in the wake of Hurricanes Helene and Milton.  Now the find he is dismantling FEMA.,,2025-03-10 22:13:28,283,4128,https://i.redd.it/nhrbdx5oyyne1.png
Lara Trump Fumes as CNN Host Calls Out Donald’s Hurricane Helene Lies,,2024-10-06 21:26:12,337,11934,https://www.thedailybeast.com/lara-trumps-cnn-interview-gets-heated-over-donald-trumps-hurricane-helene-misinformation
My husband wants to name our daughter Hurricane. ,Please for the love of god help a pregnant lady out. I get that the word *sounds* pretty but it's literally a natural disaster. Katrina would be preferable. He's liked this since he was a kid. ,2024-06-27 00:58:22,2364,4222,https://www.reddit.com/r/tragedeigh/comments/1dpj6pg/my_husband_wants_to_name_our_daughter_hurricane/
Kamala Harris 'is in control of this hurricane' using 'weather weapons': Alex Jones,,2024-10-08 14:21:22,957,3657,https://www.rawstory.com/alex-jones-hurricane/
The National Guard has deployed a shelter at Tropicana Field in St. Petersburg ahead of Hurricane Milton. This scene is very similar to Hurricane Katrina in 2005 when the Super Dome was used as shelter.,,2024-10-07 17:07:18,314,13575,https://i.redd.it/bucp4jo0getd1.jpeg
Alexandria Ocasio-Cortez Explains Climate Change and Hurricanes Amid Misinformation Epidemic,"To read the post online, please click [here](https://twitter.com/aoc/status/1844113605068980635).",2024-10-09 22:45:03,266,23549,https://i.redd.it/3o6f30n3eutd1.jpeg
"Expats Desert Jamaica During Hurricane, Return, and Then Deny Its Impact",,2024-07-07 21:29:49,533,10676,https://v.redd.it/t5rsks8257bd1
Brooke Adams/ Tessmacher is the latest wrestler to share weather/hurricane conspiracies ,,2024-10-10 16:09:43,1643,2882,https://i.redd.it/rfczrglgkztd1.jpeg
"DeSantis again skips meeting with Biden after hurricane hits state
",,2024-10-03 19:11:31,423,7259,https://www.politico.com/news/2024/10/03/ron-desantis-joe-biden-hurricane-helene-00182403
Ron DeSantis is refusing to take Harris' call on Hurricane Helene,,2024-10-07 15:57:17,543,5139,https://www.nbcnews.com/politics/kamala-harris/ron-desantis-harris-call-hurricane-helene-political-rcna174276
Hurricanes are now political ,https://x.com/ratlimit/status/1843840098762420414,2024-10-10 11:01:02,354,9039,https://i.redd.it/bou8e7qe1ytd1.jpeg
Ron DeSantis is refusing to take Harris' call on Hurricane Helene,,2024-10-07 13:26:42,611,4588,https://www.nbcnews.com/politics/kamala-harris/ron-desantis-harris-call-hurricane-helene-political-rcna174276
'Enraging': Republicans ‘suddenly’ see disinformation problem amid hurricane crisis,,2024-10-10 06:31:48,331,9693,https://www.yahoo.com/news/enraging-republicans-suddenly-see-disinformation-003950846.html
Boomer Proudly Displays French Fry Award To Hurricane Victims ,,2024-10-21 17:33:41,459,5348,https://i.redd.it/7egvn4ahh6wd1.jpeg
Why is Hillary Clinton sending a hurricane to California?,,2023-08-20 00:16:08,1882,24169,https://www.reddit.com/r/shittyaskscience/comments/15w14l6/why_is_hillary_clinton_sending_a_hurricane_to/
Lieutenant Dan survived hurricane Milton ,,2024-10-10 19:34:18,576,4493,https://v.redd.it/r2a5dkbxk0ud1
‘A nightmare scenario’: man rescued 48km off Florida coast clinging to ice box after Hurricane Milton,,2024-10-10 20:32:38,334,8796,https://www.theguardian.com/us-news/2024/oct/11/a-nightmare-scenario-man-rescued-48km-off-florida-coast-clinging-to-ice-box-after-hurricane-milton
This unfortunate squid traveled at least 250 miles to Atlanta via the hurricane,,2024-09-27 21:50:02,281,14921,https://www.reddit.com/gallery/1fr3r9c
Name the Kitten We Found Abandoned in the Hurricane,"We found her abandoned during the hurricane and did our best to wait for the mom to come back while keeping her dry, but she never did even though we've been on the lookout all week. She's a spicy little one, but very friendly. We usually go for human names, but not required. ",2024-09-29 10:42:59,898,3360,https://i.redd.it/lk3le2m5grrd1.jpeg
Walmart flooded after hurricane,,2024-09-29 15:09:21,661,4034,https://v.redd.it/19x3hbeorsrd1
🔥 This is what a cat 5 hurricane looks like. ,,2024-10-10 16:13:39,345,7677,https://v.redd.it/6awjw9i6lztd1
Dolly Parton to donate $1 million to Hurricane Helene relief efforts,,2024-10-06 05:19:14,260,15129,https://www.cbsnews.com/news/dolly-parton-hurricane-helene-relief-efforts-one-million-dollar-donation/
"Hurricanes becoming so strong that new category needed, study says",,2024-02-05 16:01:08,772,12828,https://www.theguardian.com/world/2024/feb/05/hurricanes-becoming-so-strong-that-new-category-needed-study-says
240 volts in all 120v outlets after hurricane Milton in Florida,"Came home from Miami, back to st Pete as my neighbor said my power was on, and my fridge was working. I got to my house and flipped a switch for the light to come on, immediately breaker flipped. 
I thought it was weird, but went to open my fridge only to smell a burnt electronic smell. The inside threshold for the fridge door was super hot, almost enough to burn my hand. 
At this point I knew something was not right. I got out my multi-meter only to read 240 volts on every single outlet in my home. I switched off the breaker and called the electric company, but it’s likely I’ll be out of power for a while as so many people have downed lines here. 
My question is, how could this have happened  the day after the hurricane, and what does this mean for anything I had plugged in? 
Several appliances were still working, but I can’t imagine with the smell and non functioning of some things that it bodes well. I’m fairly certain the company also didn’t come out after the storm, because very few of my neighbors have power currently. ",2024-10-11 14:24:19,670,3565,https://i.redd.it/ykqi5iok66ud1.jpeg
"For the love of God, stop panic buying at Publix before a hurricane 😭","I’m here doing my routine shopping (in CENTRAL Florida) and I can’t even buy chicken for dinner because it’s totally sold out. CHICKEN. Honestly my mistake, I’m a Florida veteran and I came to the store the day before a storm. 

People have their carts filled to the brim as if they’d die without a surplus of food. Y’all need to chill out. I have a good friend who works at Publix and the amount of returns they get a day after a storm passes is insane btw. 

TLDR; stay home and don’t go to the grocery store to panic buy. You’re only allowed to do your usual shopping. ",2024-09-25 12:53:35,900,3219,https://www.reddit.com/r/florida/comments/1fp9azv/for_the_love_of_god_stop_panic_buying_at_publix/
Hurricane Milton from space. Footage by NASA. ,,2024-10-09 11:30:04,263,11031,https://v.redd.it/mxlsnh7o1rtd1
A man called lieutenant Dan is braving hurricane Milton in his boat,,2024-10-09 13:30:11,1083,2655,https://v.redd.it/xvi75u21nrtd1
DeSantis again skips meeting with Biden after hurricane hits state,,2024-10-03 16:55:22,373,6024,https://www.politico.com/news/2024/10/03/ron-desantis-joe-biden-hurricane-helene-00182403
