The Miami Hurricanes have been eliminated from ACC Championship contention ,"Following Miami’s loss to Syracuse, Clemson will now play against SMU for the ACC Championship in Charlotte next week.  21 years and counting for the Canes.",2024-11-30 19:09:21,430,2173,https://www.reddit.com/r/CFB/comments/1h3q9a3/the_miami_hurricanes_have_been_eliminated_from/
"Hurricane Ida will be ‘strongest storm’ to hit Louisiana since 1850s, governor warns",,2021-08-28 16:37:30,6321,48752,https://www.wafb.com/2021/08/28/hurricane-ida-will-be-strongest-storm-hit-louisiana-since-1850s-governor-warns/
Meteorologists Get Death Threats as Hurricane Milton Conspiracy Theories Thrive,,2024-10-09 22:19:19,325,3332,https://www.rollingstone.com/culture/culture-features/hurricane-milton-misinformation-meteorlogist-death-threats-1235130352/
Cameraman Drops Camera to Run to Help People Fleeing Hurricane Ian,,2022-10-01 08:37:04,882,41208,https://v.redd.it/a9rrz3akv6r91
"Ron DeSantis says insurers will return to Florida after hurricane season 'So knock on wood, we won't have a big storm this summer.'",,2023-07-12 21:33:41,1263,6088,https://floridapolitics.com/archives/622955-ron-desantis-says-insurers-will-return-to-florida-after-hurricane-season/
Acapulco after CAT 5 hurricane Otis.,,2023-10-26 16:22:29,456,11822,https://www.reddit.com/gallery/17h5oqu
The number of hurricanes this plane has flown.,,2023-08-30 22:05:49,363,41660,https://i.redd.it/aj2594b0tclb1.jpg
First-ever tropical storm watch issued for Southern California as Hurricane Hilary barrels north,,2023-08-18 14:02:09,887,6470,https://www.latimes.com/california/story/2023-08-18/hurricane-hilary-category-4-southern-california
Tornado hits home during Hurricane Milton Tornado Outbreak,,2024-10-11 19:25:47,293,3499,https://v.redd.it/0756s11co7ud1
Vice President Kamala Harris at FEMA headquarters in the aftermath of Hurricane Helene.,,2024-10-04 20:24:21,308,3400,https://i.redd.it/m3cf3al30usd1.jpeg
Matt Gaetz votes against disaster relief days after Hurricane Ian hits,,2022-10-01 13:48:05,978,21250,https://www.newsweek.com/matt-gaetz-votes-against-disaster-relief-hurricane-ian-1748055
LPT Be extra cautious buying a used car in the months after a hurricane or major flooding event,"Many cars damaged by rising waters are written off by insurers as a total loss, and their titles are marked as such. They will be sold as salvage and not intended to be driven again. But it's very common for people to buy the salvage vehicles at auction and instead of stripping them for usable parts or recyclable metal as is intended, they are cheaply repaired and resold, sometimes many states or provinces away so just because you're nowhere near the hurricane doesn't mean you won't still get one of these water damaged vehicles. Not only are they a huge risk for mold nd rust, but they can have massive electrical and engine problems in the future that can be hidden for a short time.

Inspect the title very carefully, and demand a carfax or other vin history to see where it was previously registered and any prior insurance claims if possible to make sure you're not just buying future headaches.",2024-09-27 09:21:02,171,9194,https://www.reddit.com/r/LifeProTips/comments/1fqnkmw/lpt_be_extra_cautious_buying_a_used_car_in_the/
The Washington Capitals will face the Carolina Hurricanes in the Second Round of the Stanley Cup Playoffs,,2025-04-30 21:49:48,410,1028,https://www.reddit.com/r/hockey/comments/1kbxfbl/the_washington_capitals_will_face_the_carolina/
Jackie Denardo is live in Tampa covering Hurricane Milton,,2024-10-09 18:40:13,184,6887,https://www.reddit.com/gallery/1g049wt
This 100% solar community endured Hurricane Ian with no loss of power and minimal damage,,2022-10-02 11:42:28,824,29450,https://www.cnn.com/2022/10/02/us/solar-babcock-ranch-florida-hurricane-ian-climate/index.html
"Florida Hurricane Relief, featuring the president and recent primary dropout DeSantis",,2024-01-21 15:39:43,428,7010,https://i.redd.it/9ih4qquztudc1.jpeg
A still-smoldering Shore Acres home destroyed by Hurricane Helene for sale. ,Kinda sums up the real estate market right now. ,2024-10-07 10:44:32,379,2688,https://i.redd.it/fo8vaa3qjctd1.jpeg
Dolly Parton Donating $1M Toward Hurricane Helene Relief Efforts,,2024-10-04 17:24:06,166,8585,https://www.hollywoodreporter.com/lifestyle/lifestyle-news/dolly-parton-donating-hurricane-helene-relief-efforts-1236024845/
My parents evacuated from the hurricane...only to turn back and just go back home,"Yep. Title says it all. My brown boomer parents live in Pinellas Park, which is still pretty much in the direct path of the hurricane. I had cried and begged them on the phone yesterday that they needed to evacuate, and they should come with me and my signifcant other down to West Palm to join up with his mom. We would have left earlier if my graduate school announced they were going to close sooner...oh well.

Anyhow, it took five plus calls and numerous text messages and the 'Guess I'm going to be an ophan' card to get them to drive over to Riverview. To make things ✨️ even better ✨️ my dad's car is having issues with the hybrid battery and he's relying on his so called 'backup' battery. His car can literally die at any time. It's been like that since hurricane Helene and GreenBean Battery has not had the chance to have one of their contractors come and help.

Dad somehow made it here to Riverview miraculously with mom, and all was going well. I made them dinner and we watched TV and it was like a sleepover. I kept warning them that Riverview might become unsafe too and we would all have to move. The plan was to use my s/o's car to boot all of us including the two furry tuxedo cats. Because MY car wasn't in a condition to go long distances either because the strut, boot and a whole bunch of other stuff broke down (great timing right?) And needs to be replaced.

Come this morning the projected path is now RIVERVIEW, and I woke up and told them we all gotta go further south. All they heard was 'Ah St Pete and Pinellas are safe now'. I explained to them that, that was not the case at all, they would still have storm surges, their fruit trees will fall, etc etc.

As they grabbed all their stuff and moved the fastest I have seen these two old folk move, I was befuddled. I looked at them and said 'Do you guys just want to pass away in your own home? Is that what's going on?'

My parents laughed, gave us hugs, and drove off.

By any chance, if anyone here recognizes who I am, my s/o and I am safe, and we have a plan. I just wanted to share how absolutely ridiculously stupid my parents are.

By the way, are there discounts on double caskets?

EDIT ONE: Safely situated in West Palm with other side of family. My s/o's niece straight up said ""If your parents pass away, you can have my room and I will make you a Hello Kitty necklace."" I will gladly take her up on that offer,  lol. Also thank you all for the support and I hope you guys are safe, both from the physical harms of the hurricane, and the emotional turmoil your parents are giving you, too. Love you all.

EDIT TWO: Everyone I know and love including my 0 IQ boomer parents are alive and well. Just deeply saddened downtown St Pete has suffered. Stay strong.",2024-10-08 12:53:38,332,2948,https://www.reddit.com/r/BoomersBeingFools/comments/1fz4lnf/my_parents_evacuated_from_the_hurricaneonly_to/
US weather forecasting is more crippled than previously known as hurricane season nears,,2025-05-02 15:11:23,120,3067,https://www.cnn.com/2025/05/02/weather/nws-forecasting-layoffs-trump
Greg Abbott Slammed for Being Abroad During Hurricane Beryl,,2024-07-08 12:38:35,373,3872,https://www.newsweek.com/hurricane-beryl-greg-abbott-critcised-asia-trip-texas-storm-landfall-1922179
Why do people not evacuate during a major weather event like Hurricane Helene?,"At least twenty people have died during Hurricane Helene so far, and more than a few of them were people who didn't evacuate when told to. As someone who lives in the upper Midwest of the USA, this behavior is utterly baffling to me. If I lived in the path of a storm like this, I'd bug out of there ASAP. What legitimate reason could anyone have for not heeding the warnings?
ETA: Tons of interesting and eye-opening answers; thank you!",2024-09-27 14:27:22,968,1602,https://www.reddit.com/r/NoStupidQuestions/comments/1fquk1u/why_do_people_not_evacuate_during_a_major_weather/
Hurricane Milton is insane,,2024-10-09 01:41:30,299,3166,https://v.redd.it/76qz8uyn4otd1
First images from Acapulco after CAT 5 hurricane Otis.,,2023-10-25 13:40:22,383,12673,https://www.reddit.com/gallery/17gage9
Trump Appears Not to Understand How Hurricanes Work,Hand this man a Sharpie!,2024-09-30 19:36:28,336,2951,https://newrepublic.com/post/186532/donald-trump-understand-hurricane-helene-season
Trump official pushes to dismantle FEMA as hurricane season looms,,2025-03-27 09:58:41,166,2547,https://www.themirror.com/news/politics/trump-official-pushes-dismantle-fema-1055068
of a hurricane,,2024-10-08 00:35:06,181,6542,https://i.redd.it/0u8hohtwngtd1.jpeg
Next time Republicans will try to find out if immigrants cause the hurricane !,,2024-10-03 16:14:01,169,7795,https://i.redd.it/lmql2q4lllsd1.jpeg
Before and After Hurricane Ian [Fort Myers Florida],,2022-09-29 10:57:35,946,17094,https://i.redd.it/5z86697watq91.jpg
I'm noticing a huge uptick in misinformation and a lack of basic hurricane education leading up to Milton. ,"I'm not sure if it's the transplants or if this has always been the case and I just haven't noticed, but I'm seeing more people than usual are failing to comprehend hurricane basics this time around and are going into pure panic mode.

Lots of people not understanding storm surge vs inland flooding.

Lots of people evacuating their brand new construction homes 30+ miles inland where they are completely safe.

Hell - I'm seeing numerous comments from people claiming it will be over Wesley Chapel & New Tampa as a sustained Cat 4 when it will certainly deteriorate prior to and during landfall.

Just a reminder, when you hear a meteorologist say that 90% of hurricane deaths are from storm surge and flooding - and that you are safe inland if you're not a mobile home or in a flood zone. That's real advice from experts you can trust. They're trying to save lives in coastal communities and flood zones. I don't understand how people hear that and think that their cement block house 40 miles inland is going to be torn from its foundation.

If you're in a safe structure inland like I've described around Wesley Chapel, you need to worry about the roads in your neighborhood being flooded and having no power for a few days. That's the preparation you need to be focused on.

**Edit:**

Some resources!

Evacuation Zone Maps: [Hillsborough](https://hcfl.gov/residents/public-safety/emergency-management/find-evacuation-information), [Pinellas](https://kyz.pinellas.gov/), [Pasco](https://pascogis.pascocountyfl.net/evaczone/finder.html)

Flood Zone Address Search: [Hillsborough](https://hcfl.gov/residents/public-safety/flooding/find-my-flood-zone), [Pinellas](https://pinellas-egis.maps.arcgis.com/apps/webappviewer/index.html?id=290b9f522116480eac5f47c9ef866503), [Pasco](https://www.pascocountyfl.net/services/building_construction/flood_and_evacuation_zone.php)

Evacuation Shelters: [Hillsborough](https://hcfl.gov/residents/stay-safe/emergency-evacuation-shelter-list), [Pinellas](https://pinellas.gov/emergency-information/public-shelters/), [Pasco](https://pascocountyfl.net/_T18_R286.php)

Sandbag Locations: [Pinellas](https://pinellas.gov/news/sandbag-locations-announced-ahead-of-tropical-storm-milton/), [Pasco](https://www.pascocountyfl.net/_T18_R280.php)

A lot of commenters also recommended a meteorologist on YouTube I've also watched for quite a bit, [Ryan Hall](https://www.youtube.com/@RyanHallYall). He will be streaming throughout landfall and is usually a great source for live info.

Wanted to also point out there are a ton of reasons you might want to evacuate even if you live inland. If you are not in a safe structure, have special needs, tons of tall heavy trees nearby or can't handle going without power for a few days, definitely consider it.

The primary goal of this post was to point out the overwhelming advice is to shelter in place if you have a safe new construction home far away from the storm surge. Take the hurricane seriously. I sandbagged my sliding glass door and stocked up for the expected loss of power. If you still want to evacuate that's perfectly fine but know you do have options. 

The only comment that is really getting to me is comparing us to Asheville. If you are comparing flat suburban Florida flooding to Mountainous flash floods from runoff I promise there is more critical thought to be had. ",2024-10-07 12:15:10,560,1961,https://www.reddit.com/r/tampa/comments/1fybkmv/im_noticing_a_huge_uptick_in_misinformation_and_a/
Hurricane Milton as seen from the ISS. Credit: Matthew Dominick,,2024-10-08 11:53:15,208,5030,https://v.redd.it/tsh79ldr0ktd1
to help hurricane survivors in North Carolina ,,2024-10-14 11:51:52,310,2963,https://i.redd.it/psan9ue4uqud1.jpeg
Texas governor says Biden comments about Hurricane Beryl aid are a ‘complete lie’, Hi! I'm a public radio reporter in Texas and I wrote this story. I'm reaching out to experts to understand more about how federal aid is distributed and who might be telling the truth here.,2024-07-10 12:59:54,604,2524,https://www.reddit.com/r/texas/comments/1e00vsu/texas_governor_says_biden_comments_about/
"First result on X searching for ""hurricane milton""",,2024-10-07 12:51:11,262,3613,https://i.redd.it/w6x2fzga6dtd1.png
Florida's biggest insurer cuts over 600K policies after Hurricane Helene,,2024-10-07 02:50:35,357,2641,https://www.newsweek.com/florida-home-insurance-policy-cut-600k-hurricane-helene-1963810
