"Biden Fumes After Reporter Parrots Trump Lies on Hurricane Helene | 
Joe Biden angrily hit back at “lying” Donald Trump over his hateful conspiracy on Hurricane Helene.",,2024-10-01 11:36:40,294,9176,https://newrepublic.com/post/186557/biden-fumes-trump-hurricane-helene-lies
Hurricane Milton,Seems like this hurricane is on a mission and there seems to be so many people stuck in its paths or unable or unwilling to leave.. I just do see how this doesn't end horribly..,2024-10-07 21:25:54,594,3652,https://i.redd.it/deoteal5qftd1.jpeg
Damage to North Carolina's Chimney Rock Village from Hurricane Helene,,2024-09-29 17:34:31,345,6851,https://i.redd.it/ibq6cbzjhtrd1.jpeg
Barnyard animals survive the hurricane and are thrilled to see owners return home,,2024-10-05 02:25:32,237,15493,https://v.redd.it/5hh0l30vsvsd1
Her dolphins are stressing her out during Hurricane Milton.,,2024-10-10 06:35:59,394,5197,https://v.redd.it/eyqklnv0qwtd1
Guy Battles Hurricane Milton to Put Up a Trump Flag,,2024-10-09 23:00:57,1044,2601,https://v.redd.it/dqquim718utd1
"Hurricane Milton evacuation checklist: food, water, and two furry queens 🐱🌪️",,2024-10-07 21:24:05,220,17766,https://i.redd.it/7l5ez8ftpftd1.jpeg
My husband found this in my mother-in-law's yard after the storm surge from the hurricane. It looks like glass bubbled.,,2024-09-27 19:41:46,457,4633,https://www.reddit.com/gallery/1fr1dcs
Hurricane Rafael is intensifying and closing in on Cuba/Gulf of Mexico,,2024-11-06 10:41:49,440,3876,https://www.cnn.com/2024/11/06/weather/hurricane-rafael-path-forecast-climate/index.html
Hurricane Ian - what 15 fr storm surge looks like (credit to Max Olson Chasing),,2022-09-29 19:57:34,5296,125965,https://v.redd.it/l0w7syf7zvq91
"Harris impromptu calls into CNN, calls Trump’s hurricane comments ‘dangerous’",,2024-10-09 14:52:47,264,9695,https://thehill.com/homenews/administration/4924499-kamala-harris-impromptu-cnn-call-hurricane-milton/
Gulf of Mexico. Sailor records Hurricane Milton from the bridge of a ship with winds above 142 mph. Hurricane Milton,,2024-10-09 01:38:15,340,6041,https://v.redd.it/seeel2834otd1
Not the beautiful Florida view anyone imagined! Courtesy of hurricane Ian.,,2022-09-30 21:55:40,4285,122713,https://i.redd.it/cw86rl67p3r91.jpg
Matt Gaetz Also Voted Against FEMA Funding Right Before Hurricane Helene Struck,,2024-10-01 06:38:06,231,13787,https://i.redd.it/zewlyxlai4sd1.jpeg
Self-proclaimed billionaire Trump launches GoFundMe to help hurricane victims,,2024-10-02 08:22:47,434,4471,https://www.independent.co.uk/news/world/americas/us-politics/trump-gofundme-hurricane-helene-billionaire-b2621975.html
No hurricane has ever crossed the equator.,,2023-04-04 00:13:47,1336,45314,https://i.redd.it/9gr2bnm04ura1.jpg
Blake Lively and Ryan Reynolds Donate $1 Million to Hurricanes Helene and Milton Relief Efforts,,2024-10-10 16:42:56,319,5973,https://variety.com/2024/more/news/blake-lively-ryan-reynolds-donate-hurricanes-helene-milton-relief-1236174910/
Trump caught lying repeatedly about response to Hurricane Helene,,2024-10-01 10:52:46,278,8153,https://www.msnbc.com/rachel-maddow-show/maddowblog/trump-caught-lying-repeatedly-response-hurricane-helene-rcna173407
Tampa Bay Completely Receded As Hurricane Ian Approaches,,2022-09-28 13:44:27,3163,100357,https://v.redd.it/jdu7inhlzmq91
Dodger Stadium as a result of Hurricane Hillary,,2023-08-20 21:39:24,1203,13508,https://i.redd.it/c9mwchc6bdjb1.jpg
Hurricane Trump is having a category 5 meltdown! 🌀,,2024-10-02 23:21:22,642,3119,https://i.redd.it/ql1crmka2gsd1.png
Our brand new seafood restaurant was destroyed by Hurricane Helene,"Just got back from helping move furniture out and wanted to share with you guys.

I work at a well known beach resort in Florida in a small kitchen open for the guests on the resort. Just in August, we opened a beautiful new fine dining seafood restaurant that cost whatever millions of amounts of dollars. It was supposed to be hurricane proof from what I’ve heard in the construction, but this is clearly not the case. 

The entire island the hotel is on was essentially underwater as well as the first floor of the hotel. Mud is everywhere. Lobby, the prep kitchen, my kitchen, the nightclub in the building, everything flooded. Even the stage where band plays is completely destroyed. Never seen anything like it since I’ve lived in Florida. Chef told us we won’t be back for another week minimum. I’m thinking two weeks after seeing the damage it caused. ",2024-09-29 14:26:38,388,4872,https://v.redd.it/1nhm5brkjsrd1
Trump Administration denies extension for Hurricane Relief in georgia.,,2025-02-16 15:37:18,280,3091,https://www.11alive.com/article/news/politics/trump-administration-denies-extension-hurricane-relief-georgia/85-bb8fc79d-a064-4e31-a460-c034b1266f11
Hurricane Milton looking like some sort of cosmic horror entity,,2024-10-09 12:03:19,214,13924,https://i.redd.it/i4d3yptl7rtd1.jpeg
President Biden in Florida this weekend surveying Hurricane Milton damage.,,2024-10-15 12:43:31,274,6894,https://i.redd.it/tb26pc288yud1.jpeg
He lost everything. Incredible footage from Hurricane Helene flooding in Western North Carolina,,2024-10-04 13:48:52,488,3641,https://www.youtube.com/watch?v=C4xA7QfIOdo
Kamala Harris 'is in control of this hurricane' using 'weather weapons': Alex Jones,,2024-10-08 15:01:17,520,3366,https://www.rawstory.com/alex-jones-hurricane/
These doors holding back the storm surge of Hurricane Ian,,2022-10-06 20:58:23,2243,100644,https://v.redd.it/jbvjvdaf8as91
Southern California just got hit with an earthquake during a hurricane,,2023-08-20 18:02:48,840,17949,https://i.redd.it/8iio2g0j8cjb1.jpg
Quick Update on the Biden-Harris Administration’s Response to Hurricane Helene.,"We’re continuing to surge resources to Georgia to make sure communities have everything they need to recover and rebuild. So far, FEMA has approved over $48 million in assistance for more than 59,000 survivors. And, FEMA Disaster Survivor Assistance Teams are on the ground continuing to help survivors apply for FEMA assistance and connect them with additional state, local, federal, and voluntary agency resources.  
  
Our Administration will be here for as long as it takes to recover and rebuild. We encourage survivors to apply for FEMA assistance, which can be done by:  
- Calling 1-800-621-3362  
- Visiting [DisasterAssistance.gov](http://DisasterAssistance.gov)  
- Using the FEMA App",2024-10-08 15:12:36,661,2768,https://www.reddit.com/r/Georgia/comments/1fz7y6v/quick_update_on_the_bidenharris_administrations/
"Cuban government asks US for aid in rare request following Hurricane Ian damage despite chilly relationship between the two nations, per WSJ",,2022-09-30 22:19:27,3331,33519,https://www.businessinsider.com/wsj-cuban-government-asks-us-aid-following-hurricane-ian-damage-2022-9?international=true&r=US&IR=T
The difference between hurricane categories,,2023-08-30 07:18:34,605,38386,https://v.redd.it/iq7osm2le8lb1
Hurricane Milton looking very ominous in this view of the earth 😳,,2024-10-07 22:34:26,203,13263,https://i.redd.it/ogoxkjtd2gtd1.jpeg
"Utility workers and their trucks are staged in Florida, preparing to fix damage caused by Hurricane Ian",,2022-09-28 12:19:21,2004,66952,https://i.redd.it/xdefo84gkmq91.jpg
"Florida's insurers deny over 37,000 hurricane claims",,2024-10-24 08:51:36,336,4396,https://www.newsweek.com/florida-insurers-deny-37000-helene-milton-hurricane-claims-1974123
Here is what a 15 foot hurricane storm surge looks like folks.,,2024-10-09 18:57:36,252,7273,https://v.redd.it/pmb9x0id9ttd1
Entire Bridge Collapsed By Hurricane 2024,Due to Hurricane Helene ,2024-09-28 19:32:44,305,5677,https://v.redd.it/lfylwpfpxmrd1
"Russia amplified hurricane disinformation to drive Americans apart, researchers find",,2024-10-24 08:53:14,287,4639,https://apnews.com/article/russia-hurricane-disinformation-fema-9e37c73ab8ffa2a2d338797a1a827e57
DeSantis Praises Biden as Florida Gov. Changes Tone Before Hurricane Ian,,2022-09-28 19:34:08,2440,30908,https://www.newsweek.com/desantis-biden-florida-hurricane-ian-1746899
Holy water and prayers against a hurricane,,2024-10-10 14:02:01,424,3465,https://v.redd.it/su6hghgoxytd1
Milton Is the Hurricane That Scientists Were Dreading,,2024-10-09 06:14:27,379,3881,https://www.theatlantic.com/science/archive/2024/10/hurricane-milton-climate-change/680188/
Hurricane Helene could cost $200 billion. Nobody knows where the money will come from. Almost none of the storm's devastation will be paid out by insurance.,,2024-10-07 17:45:56,551,2821,https://grist.org/extreme-weather/hurricane-helene-flood-damage-cost-insurance/
Slavin scores in OT - Hurricanes win Game 1 on the Road,,2025-05-06 22:11:17,275,1701,https://v.redd.it/nz6x5cwkq9ze1
"Buddy took a loss in Naples, FL following the hurricane",,2024-10-13 03:25:49,307,4734,https://i.redd.it/g7nagxxw6hud1.jpeg
"$5 Hurricane Hot Deal (Orlando, FL)",My buddy is a psycho. Imagine playing in this just to shoot 110…,2024-10-09 14:50:12,266,5819,https://www.reddit.com/gallery/1fzyyf5
WIBTA for abandoning my family during hurricane milton?,"i (21F) reside in a mandatory evacuation zone for hurricane milton and my parents (53F 52M) are absolutely refusing to evacuate our house. my boyfriend who lives in orlando traveled over an hour to see me this morning to try and offer my parents a place to stay with him, to convince them to leave since nothing i’ve said has had any effect, bring us sandbags and help us board up our windows in last minute preparations (since my parents didn’t even want to do that much.) i’m extremely stressed out and worried for the safety of my family which includes my teenage brother and our two cats, because if we are to be hit as hard as the news predicts it’s unfair of us as their owners who are responsible for their wellbeing to make them suffer unnecessarily. i even asked my boyfriend if he would be willing to take my cats back to orlando with him and have them stay at his parents place for a little until the storm passes, to which he of course agreed, but my mother doubled down and insisted that things will be fine and she can handle taking care of the cats. the entire situation is surreal to me. i can’t understand the root of my parents stubbornness, maybe it’s material attachment, but to willingly put me, my brother, and my cats’ wellbeings at risk is unfathomable to me. i feel like they’re not taking it seriously because we’ve never been seriously impacted by a hurricane before, and they’re under the assumption they’ll be able to just ride it out like any other storm, but this isn’t any other storm. when my bf and i pressed the issue before he left back home my father snapped at me and told me if i want to go, then to just go and that they’ll be fine here at home. my bf tells me that my brother and i shouldn’t have to pay the cost of their decision or be obligated to stay just because they choose to. i want to prioritize my own and my cats wellbeing but at the same time the thought of leaving my parents behind obviously breaks my heart, what could i possibly do? WIBTA if i were to leave?

EDIT: i already posted a separate update post but i figured since this is still gaining steady traction i would update here too. our plan changed last minute (again) but me, my parents, my brother and our cats, ended up staying with a group of relatives 30mi further inland. unfortunately not orlando like the original plan as my father deemed it would have been too dangerous to drive that far on the roads this morning when we woke up at 7 but i am genuinely very happy to have my entire family with me and had we gone to orlando to stay with my boyfriend like intended my mother would most likely have stayed behind in a local emergency shelter as she didn’t want to travel that far. we left at 9am, arrived maybe around 10am and it is currently 10pm, experiencing fluctuating rain and wind strength but so far we still have power/water/etc. my cats are probably a little stressed, but otherwise safe and healthy and thankfully did very well on the car ride over here. i’ve been on the phone with my boyfriend and us and our families are all still doing well. thank you so much for everyone who is invested in our wellbeing, will update again after the hurricane passes. <3

FINAL UPDATE: we got home earlier this morning and thankfully aside from some flooded roads, lots of debris and a loss of power, our house/neighborhood is all good. so now i guess my parents can say i told you so lol :) but i’m very relieved and very fortunate to be able to say that and i’m glad it’s not the alternative. my relatives whose house we were staying in also experienced no flooding or major damage, and the drive home wasn’t bad either. the cats are also okay! the only injuries we sustained overall are some scratches from trying to give one of them a bath (because he shit himself in the carrier on the way home.) other than that though everyone is safe and well and i cannot thank everyone enough for your concern and support. thank you to everyone who reached out to share their stories and experiences and i hope you all remain safe, prepared and precautious for any storms ahead. ",2024-10-08 22:43:03,946,2077,https://www.reddit.com/r/AITA_WIBTA_PUBLIC/comments/1fzhjyk/wibta_for_abandoning_my_family_during_hurricane/
To have a non controversial telethon for Hurricane Katrina victims,,2024-07-23 18:03:53,350,6056,https://v.redd.it/hgz979otcced1
Obama comforts hurricane victim 10/31/2013,,2025-02-27 12:39:27,154,4980,https://i.redd.it/zzy3kgeaxple1.jpeg
"Deadly Hurricane Ian, nearing Category 5 strength, threatens 'catastrophic' storm surge as it nears Florida. It's too late to leave for many, governor says",,2022-09-28 09:44:52,2887,17790,https://www.cnn.com/2022/09/28/weather/hurricane-ian-florida-path-wednesday/index.html
Wakulla country in Florida abandons prisoners in the path of a unprecedented hurricane,,2024-09-27 00:38:24,323,4413,https://i.redd.it/mhoqfs0h6ard1.jpeg
"So we all agree this was the best episode of the Hurricane Trilogy, right?",,2024-10-16 21:03:42,310,4141,https://i.redd.it/dmsifvfeu7vd1.jpeg
PC is now in the attic. Evacuating due to potential storm surge from Hurricane Milton.,,2024-10-09 07:34:16,342,3782,https://www.reddit.com/gallery/1fzp8xw
Amazon Worker Delivers to 172 People During Hurricane Ian: 'I Hate Y'all',,2022-10-01 00:32:56,1366,36862,https://www.newsweek.com/amazon-worker-delivers-172-people-during-hurricane-ian-i-hate-yall-1747722
Why are people putting all their belongings outside before Hurricane Milton comes?,"Is it because they're going to get destroyed from floods anyways and it'll be a hassle to remove from the house? It seems like half the danger from the hurricane is all the junk everywhere in people's yards that will become projectiles once the storm kicks in, so why leave it outside?",2024-10-08 16:15:19,387,3314,https://www.reddit.com/r/NoStupidQuestions/comments/1fz9fit/why_are_people_putting_all_their_belongings/
Hurricane Helene could cost $200 billion. No one knows who'll pay.,,2024-10-07 11:39:57,515,2611,https://grist.org/extreme-weather/hurricane-helene-flood-damage-cost-insurance/
Mike Johnson: There’s No Rush For Congress To Approve Hurricane Relief,,2024-10-07 15:40:27,347,3580,https://www.huffpost.com/entry/mike-johnson-congress-wont-vote-early-hurricane-relief_n_6703e86fe4b097cbbcb61d21
"Entering my apartment the day after Hurricane Ian (September 30, 2022)",,2023-04-19 00:50:20,804,19041,https://v.redd.it/8q50u0z2ctua1
Hurricane in Europe,"How unusual is it to have an Atlantic Hurricane to hit Europe?
",2024-10-07 13:18:45,234,6016,https://i.redd.it/qn3zpfj8bdtd1.jpeg
Matt Gaetz votes against disaster relief days after Hurricane Ian hits his own state,,2022-10-01 04:01:32,1219,35891,https://www.newsweek.com/matt-gaetz-votes-against-disaster-relief-hurricane-ian-1748055
Hurricane Idalia is approaching Florida.,,2023-08-29 18:45:43,680,10985,https://v.redd.it/aukx446co4lb1
Quick Update on the Biden-Harris Administration’s Response to Hurricane Milton.,"President Biden has directed his Administration to do everything possible to prepare for Hurricane Milton:

* President Biden granted emergency declarations to the State of Florida and the Seminole Tribe of Florida to help cover costs for life-safety and life-sustaining actions ahead of the storm
* FEMA surged search and rescue teams, water, food, power generators, and ambulances to the region
* FEMA is prepared to coordinate a full-fledged federal response
* Administrator Deanne Criswell will be in Florida to oversee the response

Evacuation orders are in effect in multiple counties. If you are in evacuation zones and have not left the area yet, you should do so immediately for your safety. Emergency shelters are open and transportation assistance is available. If you can’t evacuate, or need a safe place to go, text SHELTER & your zip code to 4-3-3-6-2 to get a list of open shelters near you.

We will be there with you as you weather this new storm.

**Update 1 – October 10, 2024**

* President Biden and Vice President Harris have been in constant contact with State and local officials
* President Biden has directed:
   * Defense Secretary Austin to provide a range of military capabilities to Florida
   * FEMA to open disaster recovery centers across the impacted communities right away
   * Federal agencies to mobilize resources, including the Department of Housing and Urban Development’s mortgage relief for impacted homeowners
* The U.S. Coast Guard and U.S. Army Corps of Engineers are assessing how fast they can reopen the Port of Tampa to get fuel, food, water, and other basic goods flowing into the area again
* The Federal Aviation Administration has authorized Florida Power and Light to fly large drones to quickly assess damage so ground crews can restore power more quickly
* More than 50,000 powerline workers have come from around the U.S. and Canada to restore power
* FEMA Administrator Deanne Criswell has been on the ground since last night and will continue to work with State and local partners to determine any unmet needs
* More than 1,000 federal personnel are on the ground

We know from previous hurricanes that it’s often the case that more lives are lost in the days following the storm than the actual storm itself. We strongly encourage everyone impacted by this storm to stay inside and off the roads – as downed power lines, debris, and road washouts are creating dangerous conditions. Please continue to shelter in place until local leaders give an all-clear.

We will continue to do everything in our power to help you recover and rebuild.

**Update 2 – October 11, 2024**

* More than 2,600 federal personnel remain on the ground
* Search and Rescue teams have supported more than 4,200 rescues and assists
* 50,000 workers are restoring power. Milton left over 3 million people without power – because of the dedication of these workers, more than 1 million people have had their power restored so far
* 1.2 million meals have been delivered, with another 1.6 million slated to be delivered today
* FEMA, the U.S. Army Corps of Engineers, and the Florida National Guard are on the ground helping the State clear debris to reopen roads for critical deliveries of food, water, tarps, and lifesaving supplies
* The U.S. Coast Guard continues to lead the effort to assess how fast we can reopen the Port of Tampa for essential deliveries of goods and fuel

Our Administration continues to reiterate that conspiracy theories and misinformation are harmful to those who most need the help. We will continue to provide all the resources necessary to rescue, recover, and rebuild.",2024-10-09 12:10:30,301,4067,https://www.reddit.com/r/florida/comments/1fzv4nw/quick_update_on_the_bidenharris_administrations/
Oak tree moving around during hurricane Beryl ,Pretty intense to watch. Luckily it didn't uproot...we are having it cut down though. Multiple trees fell on roof's throughout the neighborhood. We do not want anymore problems in case a stronger hurricane sweeps through.,2024-07-17 19:15:05,335,5437,https://v.redd.it/42kmy3y0w5dd1
Hurricane Milton’s lightning wall,,2024-10-09 21:59:39,142,25788,https://v.redd.it/xbyh57306utd1
Hurricane Fiona knocks out power to all of Puerto Rico,,2022-09-18 14:43:11,1330,24118,https://www.washingtonpost.com/climate-environment/2022/09/18/fiona-puerto-rico-hurricane-outages/
Tropicana Field after the hurricane ,,2024-10-10 08:21:52,347,3335,https://i.redd.it/ggxvnz8x8xtd1.jpeg
Kemp praises Biden’s Hurricane Helene response amid Trump criticism,,2024-09-30 17:31:23,164,12840,https://thehill.com/homenews/administration/4908016-georgia-kemp-biden-hurricane-helene/
